710144420692238337	@midnight #addawomanimproveamovie Lord of the Rings: Fellowship of the Traveling Pants	0
710138574872641540	Paula Blart: Soccer Mom #AddAWomanImproveAMovie @midnight	0
710151221584252932	The Hills Have Bette Davis Eyes  #AddAWomanImproveAMovie @midnight	0
710153660815253504	@midnight #AddAWomanImproveAMovie The Hills Have Eyes, and They're Up Here, Pal.	0
710153665504538624	Mrs. &amp; Mrs. Smith #AddAWomanImproveAMovie @midnight	0
709945441454952448	Extremely Loud and Incredibly Glenn Close #AddAWomanImproveAMovie @midnight	1
709947968238067712	Elizabeth Taylor Soldier Spy #AddAWomanImproveAMovie @midnight	1
709950128141025282	Maya Angelous in the Outfield #AddAWomanImproveAMovie @midnight	2
709947386450350081	Taxi Minnie Driver #AddAWomanImproveAMovie @midnight	1
709947142757097472	Elizabeth Warren Peace #AddAWomanImproveAMovie @midnight	1
709949379206094848	Indiana Grace Jones and the Temple of Doom #AddAWomanImproveAMovie @midnight	1
709949074372427776	For Whom the Lake Bell Tolls #AddAWomanImproveAMovie @midnight	1
709945975566020608	A Joan Rivers Runs Through It #AddAWomanImproveAMovie @midnight	1
709946609019314177	@midnight #AddAWomanImproveAMovie 3:10 to Uma Thurman	1
709949749227487232	A History of Viola Davis #AddAWomanImproveAMovie @midnight	1
